08:00.0 Ethernet controller [0200]: Realtek Semiconductor Co., Ltd. RTL8111/8168/8211/8411 PCI Express Gigabit Ethernet Controller [10ec:8168] (rev 15)
	Subsystem: ASUSTeK Computer Inc. Onboard RTL8111H Ethernet [1043:8677]
	Control: I/O+ Mem+ BusMaster+ SpecCycle- MemWINV- VGASnoop- ParErr- Stepping- SERR- FastB2B- DisINTx+
	Status: Cap+ 66MHz- UDF- FastB2B- ParErr- DEVSEL=fast >TAbort- <TAbort- <MAbort- >SERR- <PERR- INTx-
	Latency: 0, Cache Line Size: 64 bytes
	Interrupts: pin B disabled, MSI(X) routed to IRQ 73
	IOMMU group: 15
	Region 0: I/O ports at f000 [size=256]
	Region 2: Memory at f6504000 (64-bit, non-prefetchable) [size=4K]
	Region 4: Memory at f6500000 (64-bit, non-prefetchable) [size=16K]
	Capabilities: [40] Power Management version 3
		Flags: PMEClk- DSI- D1+ D2+ AuxCurrent=375mA PME(D0+,D1+,D2+,D3hot+,D3cold+)
		Status: D0 NoSoftRst+ PME-Enable- DSel=0 DScale=0 PME-
	Capabilities: [50] MSI: Enable- Count=1/1 Maskable- 64bit+
		Address: 0000000000000000  Data: 0000
	Capabilities: [70] Express (v2) Endpoint, IntMsgNum 1
		DevCap:	MaxPayload 128 bytes, PhantFunc 0, Latency L0s <512ns, L1 <64us
			ExtTag- AttnBtn- AttnInd- PwrInd- RBE+ FLReset- SlotPowerLimit 26W TEE-IO-
		DevCtl:	CorrErr+ NonFatalErr+ FatalErr+ UnsupReq+
			RlxdOrd+ ExtTag- PhantFunc- AuxPwr- NoSnoop-
			MaxPayload 128 bytes, MaxReadReq 4096 bytes
		DevSta:	CorrErr- NonFatalErr- FatalErr- UnsupReq- AuxPwr+ TransPend-
		LnkCap:	Port #0, Speed 2.5GT/s, Width x1, ASPM L0s L1, Exit Latency L0s unlimited, L1 <64us
			ClockPM+ Surprise- LLActRep- BwNot- ASPMOptComp+
		LnkCtl:	ASPM Disabled; RCB 64 bytes, LnkDisable- CommClk+
			ExtSynch- ClockPM- AutWidDis- BWInt- AutBWInt- FltModeDis-
		LnkSta:	Speed 2.5GT/s, Width x1
			TrErr- Train- SlotClk+ DLActive- BWMgmt- ABWMgmt-
		DevCap2: Completion Timeout: Range ABCD, TimeoutDis+ NROPrPrP- LTR+
			 10BitTagComp- 10BitTagReq- OBFF Via message/WAKE#, ExtFmt- EETLPPrefix-
			 EmergencyPowerReduction Not Supported, EmergencyPowerReductionInit-
			 FRS- TPHComp- ExtTPHComp-
			 AtomicOpsCap: 32bit- 64bit- 128bitCAS-
		DevCtl2: Completion Timeout: 50us to 50ms, TimeoutDis-
			 AtomicOpsCtl: ReqEn-
			 IDOReq- IDOCompl- LTR- EmergencyPowerReductionReq-
			 10BitTagReq- OBFF Disabled, EETLPPrefixBlk-
		LnkCap2: Supported Link Speeds: 2.5GT/s, Crosslink- Retimer- 2Retimers- DRS-
		LnkCtl2: Target Link Speed: 2.5GT/s, EnterCompliance- SpeedDis-
			 Transmit Margin: Normal Operating Range, EnterModifiedCompliance- ComplianceSOS-
			 Compliance Preset/De-emphasis: -6dB de-emphasis, 0dB preshoot
		LnkSta2: Current De-emphasis Level: -6dB, EqualizationComplete- EqualizationPhase1-
			 EqualizationPhase2- EqualizationPhase3- LinkEqualizationRequest-
			 Retimer- 2Retimers- CrosslinkRes: unsupported, FltMode-
	Capabilities: [b0] MSI-X: Enable+ Count=4 Masked-
		Vector table: BAR=4 offset=00000000
		PBA: BAR=4 offset=00000800
	Capabilities: [100 v2] Advanced Error Reporting
		UESta:	DLP- SDES- TLP- FCP- CmpltTO- CmpltAbrt- UnxCmplt- RxOF- MalfTLP-
			ECRC- UnsupReq- ACSViol- UncorrIntErr- BlockedTLP- AtomicOpBlocked- TLPBlockedErr-
			PoisonTLPBlocked- DMWrReqBlocked- IDECheck- MisIDETLP- PCRC_CHECK- TLPXlatBlocked-
		UEMsk:	DLP- SDES- TLP- FCP- CmpltTO- CmpltAbrt- UnxCmplt- RxOF- MalfTLP-
			ECRC- UnsupReq- ACSViol- UncorrIntErr+ BlockedTLP- AtomicOpBlocked- TLPBlockedErr-
			PoisonTLPBlocked- DMWrReqBlocked- IDECheck- MisIDETLP- PCRC_CHECK- TLPXlatBlocked-
		UESvrt:	DLP+ SDES+ TLP- FCP+ CmpltTO- CmpltAbrt- UnxCmplt- RxOF+ MalfTLP+
			ECRC- UnsupReq- ACSViol- UncorrIntErr+ BlockedTLP- AtomicOpBlocked- TLPBlockedErr-
			PoisonTLPBlocked- DMWrReqBlocked- IDECheck- MisIDETLP- PCRC_CHECK- TLPXlatBlocked-
		CESta:	RxErr- BadTLP- BadDLLP- Rollover- Timeout- AdvNonFatalErr- CorrIntErr- HeaderOF-
		CEMsk:	RxErr- BadTLP- BadDLLP- Rollover- Timeout- AdvNonFatalErr+ CorrIntErr+ HeaderOF-
		AERCap:	First Error Pointer: 00, ECRCGenCap+ ECRCGenEn- ECRCChkCap+ ECRCChkEn-
			MultHdrRecCap- MultHdrRecEn- TLPPfxPres- HdrLogCap-
		HeaderLog: 00000000 00000000 00000000 00000000
	Capabilities: [140 v1] Virtual Channel
		Caps:	LPEVC=0 RefClk=100ns PATEntryBits=1
		Arb:	Fixed- WRR32- WRR64- WRR128-
		Ctrl:	ArbSelect=Fixed
		Status:	InProgress-
		VC0:	Caps:	PATOffset=00 MaxTimeSlots=1 RejSnoopTrans-
			Arb:	Fixed- WRR32- WRR64- WRR128- TWRR128- WRR256-
			Ctrl:	Enable+ ID=0 ArbSelect=Fixed TC/VC=01
			Status:	NegoPending- InProgress-
	Capabilities: [160 v1] Device Serial Number 01-00-00-00-68-4c-e0-00
	Capabilities: [170 v1] Latency Tolerance Reporting
		Max snoop latency: 0ns
		Max no snoop latency: 0ns
	Capabilities: [178 v1] L1 PM Substates
		L1SubCap: PCI-PM_L1.2+ PCI-PM_L1.1+ ASPM_L1.2+ ASPM_L1.1+ L1_PM_Substates+
			  PortCommonModeRestoreTime=150us PortTPowerOnTime=150us
		L1SubCtl1: PCI-PM_L1.2- PCI-PM_L1.1- ASPM_L1.2- ASPM_L1.1-
			   T_CommonMode=0us LTR1.2_Threshold=306176ns
		L1SubCtl2: T_PwrOn=150us
	Kernel driver in use: r8169
	Kernel modules: r8169
00: ec 10 68 81 07 04 10 00 15 00 00 02 10 00 00 00
10: 01 f0 00 00 00 00 00 00 04 40 50 f6 00 00 00 00
20: 04 00 50 f6 00 00 00 00 00 00 00 00 43 10 77 86
30: 00 00 00 00 40 00 00 00 00 00 00 00 ff 01 00 00
40: 01 50 c3 ff 08 00 00 00 00 00 00 00 00 00 00 00
50: 05 70 80 00 00 00 00 00 00 00 00 00 00 00 00 00
60: 00 00 00 00 00 00 00 00 00 00 00 00 00 00 00 00
70: 10 b0 02 02 c0 8c 68 00 1f 50 10 00 11 7c 47 00
80: 40 00 11 10 00 00 00 00 00 00 00 00 00 00 00 00
90: 00 00 00 00 1f 08 0c 00 00 00 00 00 02 00 00 00
a0: 00 00 00 00 00 00 00 00 00 00 00 00 00 00 00 00
b0: 11 00 03 80 04 00 00 00 04 08 00 00 00 00 00 00
c0: 00 00 00 00 00 00 00 00 00 00 00 00 00 00 00 00
d0: 00 00 00 00 00 00 00 00 00 00 00 00 00 00 00 00
e0: 00 00 00 00 00 00 00 00 00 00 00 00 00 00 00 00
f0: 00 00 00 00 00 00 00 00 00 00 00 00 00 00 00 00
100: 01 00 02 14 00 00 00 00 00 00 40 00 30 20 46 00
110: 00 00 00 00 00 60 00 00 a0 00 00 00 00 00 00 00
120: 00 00 00 00 00 00 00 00 00 00 00 00 00 00 00 00
130: 00 00 00 00 00 00 00 00 00 00 00 00 00 00 00 00
140: 02 00 01 16 00 00 00 00 00 00 00 00 00 00 00 00
150: 00 00 00 00 01 00 00 80 00 00 00 00 00 00 00 00
160: 03 00 01 17 00 e0 4c 68 00 00 00 01 00 00 00 00
170: 18 00 81 17 00 00 00 00 1e 00 01 00 1f 96 79 00
180: 10 00 2b 41 79 00 00 00 00 00 00 00 00 00 00 00
190: 00 00 00 00 00 00 00 00 00 00 00 00 00 00 00 00
1a0: 00 00 00 00 00 00 00 00 00 00 00 00 00 00 00 00
1b0: 00 00 00 00 00 00 00 00 00 00 00 00 00 00 00 00
1c0: 00 00 00 00 00 00 00 00 00 00 00 00 00 00 00 00
1d0: 00 00 00 00 00 00 00 00 00 00 00 00 00 00 00 00
1e0: 00 00 00 00 00 00 00 00 00 00 00 00 00 00 00 00
1f0: 00 00 00 00 00 00 00 00 00 00 00 00 00 00 00 00
200: 00 00 00 00 00 00 00 00 00 00 00 00 00 00 00 00
210: 00 00 00 00 00 00 00 00 00 00 00 00 00 00 00 00
220: 00 00 00 00 00 00 00 00 00 00 00 00 00 00 00 00
230: 00 00 00 00 00 00 00 00 00 00 00 00 00 00 00 00
240: 00 00 00 00 00 00 00 00 00 00 00 00 00 00 00 00
250: 00 00 00 00 00 00 00 00 00 00 00 00 00 00 00 00
260: 00 00 00 00 00 00 00 00 00 00 00 00 00 00 00 00
270: 00 00 00 00 00 00 00 00 00 00 00 00 00 00 00 00
280: 00 00 00 00 00 00 00 00 00 00 00 00 00 00 00 00
290: 00 00 00 00 00 00 00 00 00 00 00 00 00 00 00 00
2a0: 00 00 00 00 00 00 00 00 00 00 00 00 00 00 00 00
2b0: 00 00 00 00 00 00 00 00 00 00 00 00 00 00 00 00
2c0: 00 00 00 00 00 00 00 00 00 00 00 00 00 00 00 00
2d0: 00 00 00 00 00 00 00 00 00 00 00 00 00 00 00 00
2e0: 00 00 00 00 00 00 00 00 00 00 00 00 00 00 00 00
2f0: 00 00 00 00 00 00 00 00 00 00 00 00 00 00 00 00
300: 00 00 00 00 00 00 00 00 00 00 00 00 00 00 00 00
310: 00 00 00 00 00 00 00 00 00 00 00 00 00 00 00 00
320: 00 00 00 00 00 00 00 00 00 00 00 00 00 00 00 00
330: 00 00 00 00 00 00 00 00 00 00 00 00 00 00 00 00
340: 00 00 00 00 00 00 00 00 00 00 00 00 00 00 00 00
350: 00 00 00 00 00 00 00 00 00 00 00 00 00 00 00 00
360: 00 00 00 00 00 00 00 00 00 00 00 00 00 00 00 00
370: 00 00 00 00 00 00 00 00 00 00 00 00 00 00 00 00
380: 00 00 00 00 00 00 00 00 00 00 00 00 00 00 00 00
390: 00 00 00 00 00 00 00 00 00 00 00 00 00 00 00 00
3a0: 00 00 00 00 00 00 00 00 00 00 00 00 00 00 00 00
3b0: 00 00 00 00 00 00 00 00 00 00 00 00 00 00 00 00
3c0: 00 00 00 00 00 00 00 00 00 00 00 00 00 00 00 00
3d0: 00 00 00 00 00 00 00 00 00 00 00 00 00 00 00 00
3e0: 00 00 00 00 00 00 00 00 00 00 00 00 00 00 00 00
3f0: 00 00 00 00 00 00 00 00 00 00 00 00 00 00 00 00
400: 00 00 00 00 00 00 00 00 00 00 00 00 00 00 00 00
410: 00 00 00 00 00 00 00 00 00 00 00 00 00 00 00 00
420: 00 00 00 00 00 00 00 00 00 00 00 00 00 00 00 00
430: 00 00 00 00 00 00 00 00 00 00 00 00 00 00 00 00
440: 00 00 00 00 00 00 00 00 00 00 00 00 00 00 00 00
450: 00 00 00 00 00 00 00 00 00 00 00 00 00 00 00 00
460: 00 00 00 00 00 00 00 00 00 00 00 00 00 00 00 00
470: 00 00 00 00 00 00 00 00 00 00 00 00 00 00 00 00
480: 00 00 00 00 00 00 00 00 00 00 00 00 00 00 00 00
490: 00 00 00 00 00 00 00 00 00 00 00 00 00 00 00 00
4a0: 00 00 00 00 00 00 00 00 00 00 00 00 00 00 00 00
4b0: 00 00 00 00 00 00 00 00 00 00 00 00 00 00 00 00
4c0: 00 00 00 00 00 00 00 00 00 00 00 00 00 00 00 00
4d0: 00 00 00 00 00 00 00 00 00 00 00 00 00 00 00 00
4e0: 00 00 00 00 00 00 00 00 00 00 00 00 00 00 00 00
4f0: 00 00 00 00 00 00 00 00 00 00 00 00 00 00 00 00
500: 00 00 00 00 00 00 00 00 00 00 00 00 00 00 00 00
510: 00 00 00 00 00 00 00 00 00 00 00 00 00 00 00 00
520: 00 00 00 00 00 00 00 00 00 00 00 00 00 00 00 00
530: 00 00 00 00 00 00 00 00 00 00 00 00 00 00 00 00
540: 00 00 00 00 00 00 00 00 00 00 00 00 00 00 00 00
550: 00 00 00 00 00 00 00 00 00 00 00 00 00 00 00 00
560: 00 00 00 00 00 00 00 00 00 00 00 00 00 00 00 00
570: 00 00 00 00 00 00 00 00 00 00 00 00 00 00 00 00
580: 00 00 00 00 00 00 00 00 00 00 00 00 00 00 00 00
590: 00 00 00 00 00 00 00 00 00 00 00 00 00 00 00 00
5a0: 00 00 00 00 00 00 00 00 00 00 00 00 00 00 00 00
5b0: 00 00 00 00 00 00 00 00 00 00 00 00 00 00 00 00
5c0: 00 00 00 00 00 00 00 00 00 00 00 00 00 00 00 00
5d0: 00 00 00 00 00 00 00 00 00 00 00 00 00 00 00 00
5e0: 00 00 00 00 00 00 00 00 00 00 00 00 00 00 00 00
5f0: 00 00 00 00 00 00 00 00 00 00 00 00 00 00 00 00
600: 00 00 00 00 00 00 00 00 00 00 00 00 00 00 00 00
610: 00 00 00 00 00 00 00 00 00 00 00 00 00 00 00 00
620: 00 00 00 00 00 00 00 00 00 00 00 00 00 00 00 00
630: 00 00 00 00 00 00 00 00 00 00 00 00 00 00 00 00
640: 00 00 00 00 00 00 00 00 00 00 00 00 00 00 00 00
650: 00 00 00 00 00 00 00 00 00 00 00 00 00 00 00 00
660: 00 00 00 00 00 00 00 00 00 00 00 00 00 00 00 00
670: 00 00 00 00 00 00 00 00 00 00 00 00 00 00 00 00
680: 00 00 00 00 00 00 00 00 00 00 00 00 00 00 00 00
690: 00 00 00 00 00 00 00 00 00 00 00 00 00 00 00 00
6a0: 00 00 00 00 00 00 00 00 00 00 00 00 00 00 00 00
6b0: 00 00 00 00 00 00 00 00 00 00 00 00 00 00 00 00
6c0: 00 00 00 00 00 00 00 00 00 00 00 00 00 00 00 00
6d0: 00 00 00 00 00 00 00 00 00 00 00 00 00 00 00 00
6e0: 00 00 00 00 00 00 00 00 00 00 00 00 00 00 00 00
6f0: 00 00 00 00 00 00 00 00 00 00 00 00 00 00 00 00
700: 76 00 63 01 ff ff ff ff 04 00 00 07 01 ff ff 27
710: 20 01 01 00 00 00 00 00 00 00 02 00 80 02 00 20
720: 00 00 00 00 00 00 00 00 51 5c 6d 03 10 07 00 08
730: 40 60 00 00 06 60 00 00 20 40 00 00 01 00 00 00
740: 0f 00 00 00 00 00 00 00 08 40 20 40 04 40 20 00
750: 00 00 80 00 00 00 00 00 00 00 00 00 00 00 00 00
760: 00 00 00 00 00 00 00 00 00 00 00 00 00 00 00 00
770: 00 00 00 00 00 00 00 00 00 00 00 00 00 00 00 00
780: 00 00 00 00 00 00 00 00 00 00 00 00 00 00 00 00
790: 00 00 00 00 00 00 00 00 00 00 00 00 00 00 00 00
7a0: 00 00 00 00 00 00 00 00 00 00 00 00 00 00 00 00
7b0: 00 00 00 00 00 00 00 00 00 00 00 00 00 00 00 00
7c0: 00 00 00 00 00 00 00 00 00 00 00 00 00 00 00 00
7d0: 00 00 00 00 00 00 00 00 00 00 00 00 00 00 00 00
7e0: 00 00 00 00 00 00 00 00 00 00 00 00 00 00 00 00
7f0: 00 00 00 00 00 00 00 00 00 00 00 00 00 00 00 00
800: 00 00 00 00 00 00 00 00 00 00 00 00 00 01 00 00
810: 00 00 00 00 00 00 00 00 00 00 00 00 00 00 00 00
820: 00 00 00 00 00 00 00 00 00 00 00 00 00 00 00 00
830: 00 00 00 00 00 00 00 00 00 00 00 00 00 00 00 00
840: 00 00 00 00 00 00 00 00 00 00 00 00 00 00 00 00
850: 00 00 00 00 00 00 00 00 00 00 00 00 00 00 00 00
860: 00 00 00 00 00 00 00 00 00 00 00 00 00 00 00 00
870: 00 00 00 00 00 00 00 00 00 00 00 00 00 00 00 00
880: 00 00 00 00 00 00 00 00 00 00 00 00 00 00 00 00
890: 00 00 00 00 00 00 00 00 00 00 00 00 00 00 00 00
8a0: 00 00 00 00 00 00 00 00 00 00 00 00 00 00 00 00
8b0: 00 00 00 00 00 00 00 00 00 00 00 00 01 00 00 00
8c0: 00 00 00 00 00 00 00 00 00 00 00 00 00 00 00 00
8d0: 00 00 00 00 32 00 00 00 00 00 00 00 00 00 00 00
8e0: 00 00 00 00 00 00 00 00 00 00 00 00 00 00 00 00
8f0: 00 00 00 00 00 00 00 00 00 00 00 00 00 00 00 00
900: 00 00 00 00 00 00 00 00 00 00 00 00 00 00 00 00
910: 00 00 00 00 00 00 00 00 00 00 00 00 00 00 00 00
920: 00 00 00 00 00 00 00 00 00 00 00 00 00 00 00 00
930: 00 00 00 00 00 00 00 00 00 00 00 00 00 00 00 00
940: 00 00 00 00 00 00 00 00 00 00 00 00 00 00 00 00
950: 00 00 00 00 00 00 00 00 00 00 00 00 00 00 00 00
960: 00 00 00 00 00 00 00 00 00 00 00 00 00 00 00 00
970: 00 00 00 00 00 00 00 00 00 00 00 00 00 00 00 00
980: 00 00 00 00 00 00 00 00 00 00 00 00 00 00 00 00
990: 00 00 00 00 00 00 00 00 00 00 00 00 00 00 00 00
9a0: 00 00 00 00 00 00 00 00 00 00 00 00 00 00 00 00
9b0: 00 00 00 00 00 00 00 00 00 00 00 00 00 00 00 00
9c0: 00 00 00 00 00 00 00 00 00 00 00 00 00 00 00 00
9d0: 00 00 00 00 00 00 00 00 00 00 00 00 00 00 00 00
9e0: 00 00 00 00 00 00 00 00 00 00 00 00 00 00 00 00
9f0: 00 00 00 00 00 00 00 00 00 00 00 00 00 00 00 00
a00: 00 00 00 00 00 00 00 00 00 00 00 00 00 00 00 00
a10: 00 00 00 00 00 00 00 00 00 00 00 00 00 00 00 00
a20: 00 00 00 00 00 00 00 00 00 00 00 00 00 00 00 00
a30: 00 00 00 00 00 00 00 00 00 00 00 00 00 00 00 00
a40: 00 00 00 00 00 00 00 00 00 00 00 00 00 00 00 00
a50: 00 00 00 00 00 00 00 00 00 00 00 00 00 00 00 00
a60: 00 00 00 00 00 00 00 00 00 00 00 00 00 00 00 00
a70: 00 00 00 00 00 00 00 00 00 00 00 00 00 00 00 00
a80: 00 00 00 00 00 00 00 00 00 00 00 00 00 00 00 00
a90: 00 00 00 00 00 00 00 00 00 00 00 00 00 00 00 00
aa0: 00 00 00 00 00 00 00 00 00 00 00 00 00 00 00 00
ab0: 00 00 00 00 00 00 00 00 00 00 00 00 00 00 00 00
ac0: 00 00 00 00 00 00 00 00 00 00 00 00 00 00 00 00
ad0: 00 00 00 00 00 00 00 00 00 00 00 00 00 00 00 00
ae0: 00 00 00 00 00 00 00 00 00 00 00 00 00 00 00 00
af0: 00 00 00 00 00 00 00 00 00 00 00 00 00 00 00 00
b00: 00 00 00 00 00 00 00 00 00 00 00 00 00 00 00 00
b10: 00 00 00 00 00 00 00 00 00 00 00 00 00 00 00 00
b20: 00 00 00 00 00 00 00 00 00 00 00 00 00 00 00 00
b30: 00 00 00 00 00 00 00 00 00 00 00 00 00 00 00 00
b40: 19 00 00 00 d3 00 00 00 00 00 00 00 00 00 00 00
b50: 00 00 00 00 00 00 00 00 00 00 00 00 00 00 00 00
b60: 00 00 00 00 00 00 00 00 00 00 00 00 00 00 00 00
b70: 00 00 00 00 00 00 00 00 00 00 00 00 00 00 00 00
b80: 00 00 00 00 00 00 00 00 00 00 00 00 00 00 00 00
b90: 00 00 00 00 00 00 00 00 00 00 00 00 00 00 00 00
ba0: 00 00 00 00 00 00 00 00 00 00 00 00 00 00 00 00
bb0: 00 00 00 00 00 00 00 00 00 00 00 00 00 00 00 00
bc0: 00 00 00 00 00 00 00 00 00 00 00 00 00 00 00 00
bd0: 00 00 00 00 00 00 00 00 00 00 00 00 00 00 00 00
be0: 00 00 00 00 00 00 00 00 00 00 00 00 00 00 00 00
bf0: 00 00 00 00 00 00 00 00 00 00 00 00 00 00 00 00
c00: 00 00 00 00 00 00 00 00 00 00 00 00 00 00 00 00
c10: 00 00 00 00 00 00 00 00 00 00 00 00 00 00 00 00
c20: 00 00 00 00 00 00 00 00 00 00 00 00 00 00 00 00
c30: 00 00 00 00 00 00 00 00 00 00 00 00 00 00 00 00
c40: 00 00 00 00 00 00 00 00 00 00 00 00 00 00 00 00
c50: 00 00 00 00 00 00 00 00 00 00 00 00 00 00 00 00
c60: 00 00 00 00 00 00 00 00 00 00 00 00 00 00 00 00
c70: 00 00 00 00 00 00 00 00 00 00 00 00 00 00 00 00
c80: 00 00 00 00 00 00 00 00 00 00 00 00 00 00 00 00
c90: 00 00 00 00 00 00 00 00 00 00 00 00 00 00 00 00
ca0: 00 00 00 00 00 00 00 00 00 00 00 00 00 00 00 00
cb0: 00 00 00 00 00 00 00 00 00 00 00 00 00 00 00 00
cc0: 00 00 00 00 00 00 00 00 00 00 00 00 00 00 00 00
cd0: 00 00 00 00 00 00 00 00 00 00 00 00 00 00 00 00
ce0: 00 00 00 00 00 00 00 00 00 00 00 00 00 00 00 00
cf0: 00 00 00 00 00 00 00 00 00 00 00 00 00 00 00 00
d00: 00 00 00 00 00 00 00 00 00 00 00 00 00 00 00 00
d10: 00 00 00 00 00 00 00 00 00 00 00 00 00 00 00 00
d20: 00 00 00 00 00 00 00 00 00 00 00 00 00 00 00 00
d30: 00 00 00 00 00 00 00 00 00 00 00 00 00 00 00 00
d40: 00 00 00 00 00 00 00 00 00 00 00 00 00 00 00 00
d50: 00 00 00 00 00 00 00 00 00 00 00 00 00 00 00 00
d60: 00 00 00 00 00 00 00 00 00 00 00 00 00 00 00 00
d70: 00 00 00 00 00 00 00 00 00 00 00 00 00 00 00 00
d80: 00 00 00 00 00 00 00 00 00 00 00 00 00 00 00 00
d90: 00 00 00 00 00 00 00 00 00 00 00 00 00 00 00 00
da0: 00 00 00 00 00 00 00 00 00 00 00 00 00 00 00 00
db0: 00 00 00 00 00 00 00 00 00 00 00 00 00 00 00 00
dc0: 00 00 00 00 00 00 00 00 00 00 00 00 00 00 00 00
dd0: 00 00 00 00 00 00 00 00 00 00 00 00 00 00 00 00
de0: 00 00 00 00 00 00 00 00 00 00 00 00 00 00 00 00
df0: 00 00 00 00 00 00 00 00 00 00 00 00 00 00 00 00
e00: 00 00 00 00 00 00 00 00 00 00 00 00 00 00 00 00
e10: 00 00 00 00 00 00 00 00 00 00 00 00 00 00 00 00
e20: 00 00 00 00 00 00 00 00 00 00 00 00 00 00 00 00
e30: 00 00 00 00 00 00 00 00 00 00 00 00 00 00 00 00
e40: 00 00 00 00 00 00 00 00 00 00 00 00 00 00 00 00
e50: 00 00 00 00 00 00 00 00 00 00 00 00 00 00 00 00
e60: 00 00 00 00 00 00 00 00 00 00 00 00 00 00 00 00
e70: 00 00 00 00 00 00 00 00 00 00 00 00 00 00 00 00
e80: 00 00 00 00 00 00 00 00 00 00 00 00 00 00 00 00
e90: 00 00 00 00 00 00 00 00 00 00 00 00 00 00 00 00
ea0: 00 00 00 00 00 00 00 00 00 00 00 00 00 00 00 00
eb0: 00 00 00 00 00 00 00 00 00 00 00 00 00 00 00 00
ec0: 00 00 00 00 00 00 00 00 00 00 00 00 00 00 00 00
ed0: 00 00 00 00 00 00 00 00 00 00 00 00 00 00 00 00
ee0: 00 00 00 00 00 00 00 00 00 00 00 00 00 00 00 00
ef0: 00 00 00 00 00 00 00 00 00 00 00 00 00 00 00 00
f00: 00 00 00 00 00 00 00 00 00 00 00 00 00 00 00 00
f10: 00 00 00 00 00 00 00 00 00 00 00 00 00 00 00 00
f20: 00 00 00 00 00 00 00 00 00 00 00 00 00 00 00 00
f30: 00 00 00 00 00 00 00 00 00 00 00 00 00 00 00 00
f40: 00 00 00 00 00 00 00 00 00 00 00 00 00 00 00 00
f50: 00 00 00 00 00 00 00 00 00 00 00 00 00 00 00 00
f60: 00 00 00 00 00 00 00 00 00 00 00 00 00 00 00 00
f70: 00 00 00 00 00 00 00 00 00 00 00 00 00 00 00 00
f80: 00 00 00 00 00 00 00 00 00 00 00 00 00 00 00 00
f90: 00 00 00 00 00 00 00 00 00 00 00 00 00 00 00 00
fa0: 00 00 00 00 00 00 00 00 00 00 00 00 00 00 00 00
fb0: 00 00 00 00 00 00 00 00 00 00 00 00 00 00 00 00
fc0: 00 00 00 00 00 00 00 00 00 00 00 00 00 00 00 00
fd0: 00 00 00 00 00 00 00 00 00 00 00 00 00 00 00 00
fe0: 00 00 00 00 00 00 00 00 00 00 00 00 00 00 00 00
ff0: 00 00 00 00 00 00 00 00 00 00 00 00 00 00 00 00

